Nama Mobil,Harga,Tahun,Usia,Bahan Bakar,Transmisi,Kapasitas Mesin,harga_angka
Toyota Avanza G (2024),Rp 216.000.000,2024,1,Bensin,Matic,1500 cc,216000000
Toyota Avanza Veloz Mpv (2015),Rp 143.000.000,2015,10,Bensin,Matic,1500 cc,143000000
Honda Brio Satya E Mt (2015),Rp 105.000.000,2015,10,Bensin,Manual,1200 cc,105000000
Mitsubishi Xpander Cross Premium At  Putih (2019),Rp 219.000.000,2019,6,Bensin,Matic,1500 cc,219000000
Daihatsu Great New Xenia X Mpv Std 1300 Mt (2016),Rp 132.000.000,2016,9,Bensin,Manual,1300 cc,132000000
Nissan Xtrail 2 0 At (2015),Rp 140.000.000,2015,10,Bensin,Matic,1997 cc,140000000
Toyota Hilux 25 G Dc Mt (2016),Rp 300.000.000,2016,9,Diesel,Manual,2500 cc,300000000
Toyota Innova (2015),Rp 160.000.000,2015,10,Bensin,Matic,1500 cc,160000000
Honda Brio Satya E Cvt  Abu (2022),Rp 150.000.000,2022,3,Bensin,Matic,1200 cc,150000000
Toyota Avanza G At (2022),Rp 195.000.000,2022,3,Bensin,Matic,1500 cc,195000000
Toyota Innova Reborn G Luxury  At (2019),Rp 280.000.000,2019,6,Bensin,Matic,2000 cc,280000000
Mitsubishi Pajero Sport 4x2 (2020),Rp 428.500.000,2020,5,Diesel,Matic,2400 cc,428500000
Honda Brio Satya E Mt (2018),Rp 127.500.000,2018,7,Bensin,Manual,1200 cc,127500000
Toyota Avanza E Cvt At (2024),Rp 189.500.000,2024,1,Bensin,Matic,1300 cc,189500000
Toyota Kijang Innova G Mpv (2018),Rp 229.000.000,2018,7,Bensin,Matic,2000 cc,229000000
Honda Brio Satya E At (2020),Rp 142.000.000,2020,5,Bensin,Matic,1200 cc,142000000
Toyota Grand Avanza G At (2017),Rp 142.000.000,2017,8,Bensin,Matic,1300 cc,142000000
Toyota Avanza G (2021),Rp 187.000.000,2021,4,Bensin,Matic,1500 cc,187000000
Toyota Innova 20 V Bensin At (2018),Rp 268.000.000,2018,7,Bensin,Matic,1500 cc,268000000
Toyota Avanza G At (2022),Rp 195.000.000,2022,3,Bensin,Matic,1500 cc,195000000
Honda Jazz Rs Hatchback (2018),Rp 207.000.000,2018,7,Bensin,Matic,1500 cc,207000000
Toyota Innova Zenix V At Hybrid Modellista Hitam (2022),Rp 425.000.000,2022,3,Hybrid,Matic,2000 cc,425000000
Honda Brio E Cvt At (2022),Rp 156.000.000,2022,3,Bensin,Matic,1200 cc,156000000
Ertiga Gx  Mt (2015),Rp 130.000.000,2015,10,Bensin,Manual,1400 cc,130000000
Mobilio E At (2017),Rp 144.000.000,2017,8,Bensin,Matic,1500 cc,144000000
Toyota Avanza G Mpv  Putih (2022),Rp 200.000.000,2022,3,Bensin,Matic,1500 cc,200000000
Toyota Kijang Innova G Bensin Mt (2020),Rp 265.000.000,2020,5,Bensin,Manual,2000 cc,265000000
Honda Jazz Rs At (2015),Rp 173.000.000,2015,10,Bensin,Matic,1500 cc,173000000
Innova Reborn G At Bensin (2020),Rp 235.000.000,2020,5,Bensin,Matic,2000 cc,235000000
Toyota Avanza G Mpv (2021),Rp 176.000.000,2021,4,Bensin,Matic,1500 cc,176000000
Toyota Avanza Veloz (2023),Rp 239.000.000,2023,2,Bensin,Matic,1500 cc,239000000
Honda Brio E Cvt (2020),Rp 154.000.000,2020,5,Bensin,Matic,1200 cc,154000000
Toyota Avanza Veloz Mpv (2015),Rp 139.000.000,2015,10,Bensin,Matic,1500 cc,139000000
Mitsubishi Xpander Ultimate At  Hitam (2019),Rp 205.000.000,2019,6,Bensin,Matic,1500 cc,205000000
Toyota Kijang Innova G Mpv  Putih (2018),Rp 240.000.000,2018,7,Bensin,Matic,2000 cc,240000000
Toyota Avanza Veloz (2023),Rp 224.500.000,2023,2,Bensin,Matic,1500 cc,224500000
Toyota Innova G Diesel At (2015),Rp 250.000.000,2015,10,Diesel,Matic,2500 cc,250000000
Toyota Agya Gr Sport (2022),Rp 142.000.000,2022,3,Bensin,Matic,1200 cc,142000000
Toyota Fortuner V 25g Vnt Turbo (2015),Rp 410.000.000,2015,10,Diesel,Matic,2755 cc,410000000
Toyota Innova Venturer Bensin At (2020),Rp 345.000.000,2020,5,Bensin,Matic,2000 cc,345000000
Toyota Avanza Veloz (2015),Rp 137.000.000,2015,10,Bensin,Matic,1500 cc,137000000
Honda Hrv E 1500 At (2016),Rp 170.000.000,2016,9,Bensin,Matic,1500 cc,170000000
Hyundai Ioniq 5 Prime Standar Range AT (2022),Rp 399.000.000,2022,3,Listrik,Matic,58 kWh,399000000
Hyundai Ioniq 5 Long Range AT (2022),Rp 470.000.000,2022,3,Listrik,Matic,72 kWh,470000000
Wuling Bingo Premium Range (2025),Rp 315.000.000,2025,0,Listrik,Matic,38 kWh,315000000
Chery Omoda 5 RZ Lux (2023),Rp 278.000.000,2023,2,Bensin,Matic,1498 cc,278000000
Wuling Air Ev Long Range (2022),Rp 158.000.000,2022,3,Listrik,Matic,28 kWh,158000000
Wuling Bingo Ev (2024),Rp 259.000.000,2024,1,Listrik,Matic,31 kWh,259000000
Wuling Air Ev Long Range (2023),Rp 178.000.000,2023,2,Listrik,Matic,28 kWh,178000000
Chery Omoda 5 RZ Lux (2023),Rp 302.000.000,2023,2,Bensin,Matic,1498 cc,302000000
Wuling Air Ev Long Range (2023),Rp 205.000.000,2023,2,Listrik,Matic,28 kWh,205000000
Wuling Bingo Ev Long Range (2023),Rp 265.000.000,2023,2,Listrik,Matic,31 kWh,265000000
Wuling Air Ev (2022),Rp 195.000.000,2022,3,Listrik,Matic,28 kWh,195000000
Mercedes Benz Eqs450 (2022),Rp 1.980.000.000,2022,3,Listrik,Matic,108 kWh,1980000000
Lexus Es 300 Hybrid (2014),Rp 250.000.000,2014,11,Hybrid,Matic,2500 cc,250000000
Land Rover Defender 110 75th Limited Edition (2023),Rp 3.350.000.000,2023,2,Hybrid,Matic,2000 cc,3350000000
Mercedes Benz Gle450 Amg 4matic (2020),Rp 1.170.000.000,2020,5,Hybrid,Matic,2999 cc,1170000000
Nissan Kicks E Power Hybrid (2021),Rp 350.000.000,2021,4,Hybrid,Matic,1200 cc,350000000
Ford Everest 4x2 At Xlt (2024),Rp 933.000.000,2024,1,Diesel,Matic,2000 cc,933000000
Ford Everest 4x2 At Xlt (2024),Rp 825.000.000,2024,1,Diesel,Matic,2000 cc,825000000
Hyundai Palisade 2.2L Signature 2WD Diesel AT (2021),Rp 621.000.000,2021,4,Diesel,Matic,2200 cc,621000000
Hyundai Santa Fe Signature Cbu (2021),Rp 480.000.000,2021,4,Diesel,Matic,2200 cc,480000000
Hyundai Santa Fe Signature Cbu (2022),Rp 485.000.000,2022,3,Diesel,Matic,2200 cc,485000000
Hyundai Staria 2.2 Diesel At (2023),Rp 739.000.000,2023,2,Diesel,Matic,2200 cc,739000000
Land Rover Devender 2.2l 110 Dc (2023),Rp 2.240.000.000,2023,2,Diesel,Matic,2200 cc,2240000000
Volkswagen Caravelle 2.0 Tdi (2014),Rp 310.000.000,2014,11,Diesel,Matic,2000 cc,310000000
Hyundai Staria 2.2 Diesel At (2022),Rp 680.000.000,2023,2,Diesel,Matic,2200 cc,680000000
Ford Everest 2.5 4x2at Xlt (2014),Rp 265.000.000,2014,11,Diesel,Matic,2500 cc,265000000
Nissan Terra Vl At (2019),Rp 342.000.000,2019,6,Diesel,Matic,2500 cc,342000000
Mitsubishi Pajero Sport Dakar 4x2 At (2022),Rp 485.000.000,2022,3,Diesel,Matic,2400 cc,485000000
Mitsubishi Pajero Sport Dakar 4x2 At (2022),Rp 525.000.000,2022,3,Diesel,Matic,2400 cc,525000000
Mitsubishi Pajero Sport Dakar 4x2 (2023),Rp 550.000.000,2023,2,Diesel,Matic,2400 cc,550000000
Mitsubishi Pajero Sport Newdakar (2023),Rp 629.000.000,2023,2,Diesel,Matic,2400 cc,629000000
Fortuner G 2.7 At Bdg (2014),Rp 311.000.000,2014,11,Diesel,Matic,2700 cc,311000000
Fortuner 2.5 At Diesel (2014),Rp 265.000.000,2014,11,Diesel,Matic,2500 cc,265000000
Toyota Kijang Innova G (2025),Rp 380.000.000,2025,0,Bensin,Manual,2000 cc,380000000
Mazda Mazda Mx-5 2.0 At (2023),Rp 760.000.000,2023,2,Bensin,Matic,1300 cc,760000000
Toyota Mark X 2.5 At (2014),Rp 199.000.000,2014,11,Bensin,Matic,1300 cc,199000000
Mitsubishi All New Triton Gls Double Cabin Mt (2018),Rp 315.000.000,2018,7,Bensin,Manual,2500 cc,315000000
Vellfire Z 2.4 At (2015),Rp 290.000.000,2015,10,Bensin,Manual,2400 cc,290000000
Mazda Cx3 Sport At (2024),Rp 329.000.000,2024,1,Bensin,Matic,1500 cc,329000000
Mazda Cx 5 Sporty (2017),Rp 278.500.000,2017,8,Bensin,Matic,2500 cc,278500000
Mazda 2 Gt At (2022),Rp 228.000.000,2022,3,Bensin,Matic,1500 cc,228000000
Mazda Cx 5 Grand Touring (2018),Rp 294.000.000,2018,7,Bensin,Matic,2000 cc,294000000
Mazda Biante At (2015),Rp 130.000.000,2015,10,Bensin,Matic,2000 cc,130000000
Mazda 3 Hb Skyactiv At (2018),Rp 255.000.000,7,2018,Matic,2000 cc,,255000000
Mazda Cx9 Turbo Skyactic (2019),Rp 415.000.000,2019,6,Bensin,Matic,2500 cc,415000000
Mazda Biante L Skyaktive At (2017),Rp 175.000.000,2017,8,Bensin,Matic,2000 cc,175000000
Mazda Cx5 Gt Kuro Black Edition Putih (2021),Rp 417.000.000,2021,4,Bensin,Matic,2500 cc,417000000
Mazda Cx9 Skyactiv Suv Turbo Awd (2022),Rp 639.900.000,2022,3,Bensin,Matic,2500 cc,639900000
Mazda 6 Elite Sedan Skyactiv (2019),Rp 365.000.000,2019,6,Bensin,Matic,2500 cc,365000000
Mazda Mx 5 Nd Rf (2024),Rp 765.000.000,2024,1,Bensin,Matic,2000 cc,765000000
Bmw 520i M Sport Package (2023),Rp 1.080.000.000,2023,2,Bensin,Matic,2000 cc,1080000000
Bmw X5 Xdrive40i G05 Xline (2021),Rp 826.000.000,2021,4,Bensin,Matic,3000 cc,826000000
Bmw 320i G20 Sport Dynamic (2022),Rp 600.000.000,2022,3,Bensin,Matic,2000 cc,600000000
Bmw 520i G30 Luxury (2020),Rp 790.000.000,2020,5,Bensin,Matic,2000 cc,790000000
Bmw X5 Xdrive35i Xline (2016),Rp 435.000.000,2016,9,Bensin,Matic,2500 cc,435000000
Bmw X1 Sdrive18i Xline (2018),Rp 350.000.000,2018,7,Bensin,Matic,1500 cc,350000000
Bmw X1 Sdrive18i Sportline (2021),Rp 625.000.000,2021,4,Bensin,Matic,1500 cc,625000000
Bmw X5 Xdrive35i Xline (2018),Rp 499.000.000,2018,7,Bensin,Matic,3000 cc,499000000
Bmw X5 Xdrive40i Xline (2019),Rp 850.000.000,2019,6,Bensin,Matic,3000 cc,850000000
Bmw 330i M Sport Sedan (2018),Rp 468.000.000,2018,7,Bensin,Matic,2000 cc,468000000
Bmw 320i Sport Sedan (2017),Rp 345.000.000,2017,8,Bensin,Matic,2000 cc,345000000
Bmw 330i M Sport At (2022),Rp 773.000.000,2022,3,Bensin,Matic,2000 cc,773000000
Bmw 520i Alpine White (2015),Rp 315.000.000,2015,10,Bensin,Matic,2000 cc,315000000
Bmw 330i M Sport G20 Turbo (2019),Rp 789.000.000,2019,6,Bensin,Matic,2000 cc,789000000
Bmw 218i Sport 318i N42 (2023),Rp 534.000.000,2023,2,Bensin,Matic,1500 cc,534000000
Bmw 218i Gran Coupe (2022),Rp 499.000.000,2022,3,Bensin,Matic,1500 cc,499000000
Bmw X5 Diesel 2.0 X Drive (2015),Rp 440.000.000,2015,10,Diesel,Matic,2000 cc,440000000
Bmw 330i M Sport Sedan (2021),Rp 645.000.000,2021,4,Bensin,Matic,2000 cc,645000000
Bmw 530i Luxury Sedan (2018),Rp 5.800.000.000,2018,7,Bensin,Matic,2000 cc,5800000000
Bmw 530 I At (2022),Rp 835.000.000,2022,3,Bensin,Matic,2000 cc,835000000
Bmw X5 Xdrive40i Xline (2023),Rp 1.350.000.000,2023,2,Bensin,Matic,3000 cc,1350000000
Bmw X3 Xdrive30i M Sport (2021),Rp 825.000.000,2021,4,Bensin,Matic,2000 cc,825000000
Bmw X3 Xdrive30i M Sport (2022),Rp 895.000.000,2022,3,Bensin,Matic,2000 cc,895000000
Bmw 730li Sedan M Sport (2018),Rp 799.000.000,2018,7,Bensin,Matic,2000 cc,799000000
Bmw 535i Gt At (2015),Rp 370.000.000,2015,10,Bensin,Matic,3000 cc,370000000
Bmw 320i At (2022),Rp 820.000.000,2022,3,Bensin,Matic,2000 cc,820000000
Bmw X3 Sdrive 201 Xline (2023),Rp 1.030.000.000,2023,2,Bensin,Matic,2000 cc,1030000000
Bmw 640i Autometic (2014),Rp 700.000.000,2014,11,Bensin,Matic,3000 cc,700000000
Bmw M2 Cmp Dct 3.0 (2021),Rp 1.250.000.000,2021,4,Bensin,Matic,1300 cc,1250000000
Mercedes Benz E350 Eqboost Amg Line (2022),Rp 838.000.000,2022,3,Bensin,Matic,2000 cc,838000000
Mercedes Benz S450 (2023),Rp 2.350.000.000,2023,2,Bensin,Matic,3000 cc,2350000000
Mercedes Benz W205 C200 Eq Boost (2020),Rp 490.000.000,2020,5,Bensin,Matic,2000 cc,490000000
Mercedes Benz C300 Amg Line Eq Boost (2020),Rp 669.000.000,2020,5,Bensin,Matic,2000 cc,669000000
Mercedes Benz Gla 200 Amg 1.5 At (2022),Rp 615.000.000,2022,3,Bensin,Matic,1500 cc,615000000
Mercedes Benz Glc200 1.5 (2021),Rp 879.000.000,2021,4,Bensin,Matic,2000 cc,879000000
Mercedes Benz Cls350 (2018),Rp 899.000.000,2018,7,Bensin,Matic,2000 cc,899000000
Mercedes Benz A200 (2021),Rp 550.000.000,2021,4,Bensin,Matic,1300 cc,550000000
Mercedes Benz S 500 L Amg Line W222 (2014),Rp 849.000.000,2014,11,Bensin,Matic,4663 cc,849000000
Mercedesbenz S400 L Exclusive W222 (2015),Rp 599.000.000,2015,10,Bensin,Matic,3000 cc,599000000
Mercedes Benz S450 (2018),Rp 1.080.000.000,2018,7,Bensin,Matic,3000 cc,1080000000
Mercy E250 Bdg Mulpis (2014),Rp 387.000.000,2014,11,Bensin,Matic,2000 cc,387000000
Lexus Lx570 F Sport At (2019),Rp 1.875.000.000,2019,6,Bensin,Matic,5663 cc,1875000000
Lexus Rx200t Luxury (2016),Rp 615.000.000,2016,9,Bensin,Matic,2000 cc,615000000
Lexus Ux200 F Sport 4x2 Cbu (2019),Rp 415.000.000,2019,6,Bensin,Matic,2000 cc,415000000
Lexus Rx200t Luxury (2017),Rp 649.000.000,2017,8,Bensin,Matic,2000 cc,649000000
Lexus Ns200t F Sport (2016),Rp 415.000.000,2016,9,Bensin,Matic,2000 cc,415000000
Lexus Es300h Ultra Luxury Hybrid Facelift (2018),Rp 565.000.000,2018,7,Bensin,Matic,2500 cc,565000000
Lexus Rx270 Hk (2015),Rp 279.000.000,2015,10,Bensin,Matic,2000 cc,279000000
Lexus Nx200 (2015),Rp 400.000.000,2015,10,Bensin,Matic,2000 cc,400000000
Lexus Rx 300h Luxury Suv (2018),Rp 867.000.000,2018,7,Bensin,Matic,2000 cc,867000000
Lexus Lm350 At 4 Seater (2021),Rp 1.450.000.000,2021,4,Bensin,Matic,3500 cc,1450000000
Lexus Ux200 Sport At (2020),Rp 528.000.000,2020,5,Bensin,Matic,2000 cc,528000000
Lexus Es 300 Hybrid Ultra (2022),Rp 723.000.000,2022,3,Bensin,Matic,2500 cc,723000000
Lexus Nx300 F Sport (2019),Rp 630.000.000,2019,6,Bensin,Matic,2000 cc,630000000
Lexus Lm350 3.5 4seater At (2023),Rp 2.000.000.000,2023,2,Bensin,Matic,3500 cc,2000000000
Lexus Lm 350 (2020),Rp 1.350.000.000,2020,5,Bensin,Matic,3500 cc,1350000000
Renault Koleos Lux (2019),Rp 196.000.000,2019,6,Bensin,Matic,2500 cc,196000000
Renault Triber Rxz (2022),Rp 119.000.000,2022,3,Bensin,Matic,1400 cc,119000000
Volkswagen Tiguan 1.4 Tsi At (2020),Rp 315.000.000,2020,5,Bensin,Matic,1400 cc,315000000
Volkswagen Polo (2018),Rp 179.000.000,2018,7,Bensin,Matic,1200 cc,179000000
Volkswagen Polo Tsi At (2016),Rp 125.000.000,2016,9,Bensin,Matic,1200 cc,125000000
Volkswagen Scirocco Tsi Hatchback Last Edition (2016),Rp 385.000.000,2016,9,Bensin,Matic,1400 cc,385000000
Mobil Vw Touareg Hitam Tahun (2015),Rp 300.000.000,2015,10,Bensin,Matic,2500 cc,300000000
Volkswagen Caravelle (2014),Rp 310.000.000,2014,11,Bensin,Matic,2000 cc,310000000
Kia Sonet Premier At (2021),Rp 221.000.000,2021,4,Bensin,Matic,1500 cc,221000000
Kia Seltos Gt At (2022),Rp 296.000.000,2022,3,Bensin,Matic,1400 cc,296000000
Kia Carrens At (2022),Rp 325.000.000,2022,3,Bensin,Matic,2000 cc,325000000
Kia All New Sportage At (2016),Rp 255.000.000,2016,9,Bensin,Matic,2000 cc,255000000
Kia Rio Matic Bdg (2014),Rp 155.000.000,2014,11,Bensin,Matic,1400 cc,155000000
Kia Grand Sedona Ultimate (2017),Rp 350.000.000,2017,8,Bensin,Matic,3300 cc,350000000
Mini Cooper S 1.6 Con At (2015),Rp 280.000.000,2015,10,Bensin,Matic,1600 cc,280000000
Mini Countryman Cooper S Suv Turbo (2017),Rp 475.000.000,2017,8,Bensin,Matic,2000 cc,475000000
Mini Cooper 2.0 S Turbo (2019),Rp 545.000.000,2019,6,Bensin,Matic,2000 cc,545000000
Mini Cooper 5 Door (2019),Rp 417.000.000,2019,6,Bensin,Matic,2000 cc,417000000
Audi Q8 Tfsi Quattro (2019),Rp 990.000.000,2019,6,Bensin,Matic,3000 cc,990000000
Audi Q5 Fsi At (2014),Rp 250.000.000,2014,11,Bensin,Matic,2000 cc,250000000
Audi Q3 Quattro At (2014),Rp 279.000.000,2014,11,Bensin,Matic,20s00 cc,279000000
Audi Tt Coupe Mk1 (2014),Rp 275.000.000,2014,11,Bensin,Manual,1800 cc,275000000
Land Rover Range Rover2.0 evoque (2014),Rp 430.000.000,2014,11,Bensin,Matic,3000 cc,430000000
Range Rover Vogue Swb Suv (2018),Rp 2.440.000.000,2018,7,Bensin,Matic,3000 cc,2440000000
Peugeot 3008 (2020),Rp 365.000.000,2020,5,Bensin,Matic,1600 cc,365000000
Peugeot 5008 Gt Line (2019),Rp 368.000.000,2019,6,Bensin,Matic,1600 cc,368000000
Morris Garage New Zs 1.5 magnify cvt (2021),Rp 225.000.000,2021,4,Bensin,Matic,1500 cc,225000000
Porsche 992 Turbo Cabrio (2023),Rp 6.250.000.000,2023,2,Bensin,Matic,3800 cc,6250000000
daihatsu sigra r mt,,0,2025,,,,0
6000km only agya 12 g mt,,0,2025,,,,0
honda brio satya e cvt,,0,2025,,,,0
innova g bensin at,,0,2025,,,,0
t,,0,2025,,,,0
daihatsu ayla x mt,,0,2025,,,,0
bmw 535i gt at,,0,2025,,,,0
toyota agya gr sport,,0,2025,,,,0
honda brio rs cvt at,,0,2025,,,,0
honda city rs hb mt,,0,2025,,,,0
innova zenix v hybrid modelista,,0,2025,,,,0
toyota calya e std mt,,0,2025,,,,0
toyota innova g 20 at,,0,2025,,,,0
toyota avanza new model g mt,,0,2025,,,,0
brio e satya mt,,0,2025,,,,0
xpander ultimate cvt km rendah lok kediri,,0,2025,,,,0
honda crv at,,0,2025,,,,0
toyota avanza veloz q non tss,,0,2025,,,,0
jazz rs,,0,2025,,,,0
mitsubishi outlander sport gls at,,0,2025,,,,0
daihatsu sigra r at,,0,2025,,,,0
toyota innova venturer bensin at,,0,2025,,,,0
xenia x mt pajak panjang tahun depan kondisi mulus seperti baru,,0,2025,,,,0
daihatsu new ayla type d plus minor change 1000 mt,,0,2025,,,,0
lexus es 300 hybrid,,0,2025,,,,0
toyota hilux 25 g dc mt,,0,2025,,,,0
mitsubishi xpander,,0,2025,,,,0
toyota fortuner vrz trd 4x4,,0,2025,,,,0
jazz rs matic,,0,2025,,,,0
toyota avanza g at,,0,2025,,,,0
mitsubishi outlander sport px action at hitam,,0,2025,,,,0
daihatsu sigra type d,,0,2025,,,,0
chery omoda 5 rz lux,,0,2025,,,,0
brio e cvt,,0,2025,,,,0
honda brio rs mt merah,,0,2025,,,,0
toyota vios g at,,0,2025,,,,0
toyota innova zenix q hybrid modelista,,0,2025,,,,0
wuling air ev long range,,0,2025,,,,0
hyundai palisade 22l signature 2wd diesel at,,0,2025,,,,0
honda crv prestige at,,0,2025,,,,0
honda brio rs at,,0,2025,,,,0
honda brio e satya at,,0,2025,,,,0
hrv e sangat baik,,0,2025,,,,0
daihatsu new ayla type x 1000 mt,,0,2025,,,,0
toyota altis v 2021 record,,0,2025,,,,0
toyota kijang innova g solar v at,,0,2025,,,,0
mitsubishi xpander cross at,,0,2025,,,,0
mitsubishi pajero sport newdakar,,0,2025,,,,0
honda jazz rs putih,,0,2025,,,,0
mercedes benz c200 eq boost w205 avantgarde,,0,2025,,,,0
toyota new avanza veloz mpv 1500 at,,0,2025,,,,0
toyota kijang innova venturer,,0,2025,,,,0
audi q5 fsi at,,0,2025,,,,0
honda jazz,,0,2025,,,,0
honda brio satya e at,,0,2025,,,,0
mobil wuling formo s,,0,2025,,,,0
mitsubishi pajero sport dakar 4x2,,0,2025,,,,0
volkswagen scirocco tsi hatchback last edition,,0,2025,,,,0
suzuki grand vitara gx hybrid,,0,2025,,,,0
toyota yaris gr sport at,,0,2025,,,,0
bmw 520i luxury sedan tahun,,0,2025,,,,0
mitsubishi pajero sport dakar,,0,2025,,,,0
lexus lm 350,,0,2025,,,,0
toyota avanza g mpv premium,,0,2025,,,,0
toyota rush gr sport at silver,,0,2025,,,,0
toyota veloz type q tss cvt,,0,2025,,,,0
fortuner vrz 4x2,,0,2025,,,,0
toyota veloz q tss at putih,,0,2025,,,,0
hyundai staria 22 diesel at,,0,2025,,,,0
suzuki ignis gx mt putih,,0,2025,,,,0
honda jazz s at,,0,2025,,,,0
bmw 528i msport f10 lci tahun,,0,2025,,,,0
honda odyssey s at,,0,2025,,,,0
toyota avanza veloz l q cvt at,,0,2025,,,,0
honda hrv e cvt,,0,2025,,,,0
h1 royal diesel,,0,2025,,,,0
toyota new avanza type e facelift 1300 mt,,0,2025,,,,0
toyota avanza veloz q at,,0,2025,,,,0
toyota yaris g at putih,,0,2025,,,,0
mitsubishi xpander cross mpv,,0,2025,,,,0
daihatsu all new xenia x mpv 1300 cvt,,0,2025,,,,0
toyota avanza veloz putih,,0,2025,,,,0
toyota innova g at,,0,2025,,,,0
toyota kijang innova venturer mpv,,0,2025,,,,0
hrv e cvt lokasi kediri,,0,2025,,,,0
toyota avanza veloz bensin mt,,0,2025,,,,0
honda mobilio rs at hitam,,0,2025,,,,0
mitsubishi xforce ultimate at putih,,0,2025,,,,0
lexus rx200t luxury,,0,2025,,,,0
toyota avanza g mpv silver,,0,2025,,,,0
toyota kijang innova g manual,,0,2025,,,,0
honda brio e satya cvt at abu,,0,2025,,,,0
honda brio rs urbanite at,,0,2025,,,,0
avanza veloz matic,,0,2025,,,,0
land rover range rover20 evoque,,0,2025,,,,0
lexus nx200,,0,2025,,,,0
toyota innova reborn v solar matic,,0,2025,,,,0
daihatsu great new xenia x mpv std 1300 mt,,0,2025,,,,0
honda jazz rs cvt merah,,0,2025,,,,0
toyota kijang innova zenix q hv cvt tss modellista hybrid at,,0,2025,,,,0
toyota kijang innova g mpv,,0,2025,,,,0
daihatsu all new xenia x mpv 1300 mt,,0,2025,,,,0
toyota avanza g matic,,0,2025,,,,0
toyota veloz q tss at hitam,,0,2025,,,,0
suzuki ertiga gx mpv,,0,2025,,,,0
toyota avanza mpv premium,,0,2025,,,,0
dijual mitsubishi delica d5 non royal tahun,,0,2025,,,,0
toyota innova venturer wagon km 36 rbuan,,0,2025,,,,0
toyota rush gr sport at,,0,2025,,,,0
toyota grand avanza g at,,0,2025,,,,0
range rover vogue swb suv,,0,2025,,,,0
honda jazz s abu,,0,2025,,,,0
suzuki ignis gx,,0,2025,,,,0
mobil mitsubishi mirage,,0,2025,,,,0
mobilio e at,,0,2025,,,,0
toyota innova reborn zenix hb v cvt,,0,2025,,,,0
renault triber rxz,,0,2025,,,,0
lexus es 300 hybrid ultra,,0,2025,,,,0
toyota kijang innova zenix v cvt bensin at,,0,2025,,,,0
honda brv e prestige at putih,,0,2025,,,,0
mercedes benz w205 c200 eq boost,,0,2025,,,,0
honda brio e cvt at,,0,2025,,,,0
wuling cortez t lux,,0,2025,,,,0
honda hrv e,,0,2025,,,,0
honda brv prestige cvt at,,0,2025,,,,0
toyota all new avanza g cvt at,,0,2025,,,,0
honda cr v prestige,,0,2025,,,,0
toyota avanza e mt,,0,2025,,,,0
honda all new hrv rs 15 turbo,,0,2025,,,,0
honda mobilio rs cvt,,0,2025,,,,0
innova zenix g at,,0,2025,,,,0
toyota kijang innova v mt,,0,2025,,,,0
toyota camry v,,0,2025,,,,0
mitsubishi xpander cross premium at hitam,,0,2025,,,,0
toyota kijang innova,,0,2025,,,,0
toyota fortuner vrz trd,,0,2025,,,,0
toyota innova g at bensin,,0,2025,,,,0
toyota avanza veloz q bensin at,,0,2025,,,,0
toyota innova zenix q hybrid at,,0,2025,,,,0
toyota innova reborn g at,,0,2025,,,,0
honda jazz s cvt,,0,2025,,,,0
toyota kijang innova g solar mt,,0,2025,,,,0
audi q8 tfsi quattro,,0,2025,,,,0
mazda cx 5 sporty,,0,2025,,,,0
bmw 520i alpine white,,0,2025,,,,0
mercedesbenz s400 l exclusive w222,,0,2025,,,,0
mazda 6 elite sedan skyactiv,,0,2025,,,,0
mitsubishi xpander cross premium mpv,,0,2025,,,,0
toyota yaris gr sport at hitam,,0,2025,,,,0
toyota kijang innova v solar at,,0,2025,,,,0
toyota new rush s suv gr sport mt,,0,2025,,,,0
toyota kijang innova zenix q hybrid cvt modelista tss at,,0,2025,,,,0
toyota kijang innova zenix hitam,,0,2025,,,,0
wuling rs almaz,,0,2025,,,,0
honda all new jazz rs,,0,2025,,,,0
mitsubishi xpander ultimate at,,0,2025,,,,0
mitsubishi xpander exceed at silver,,0,2025,,,,0
toyota innova mt diesel,,0,2025,,,,0
honda hrv e 1500 at,,0,2025,,,,0
mitsubishi pajero sport dakar 4x2 at,,0,2025,,,,0
toyota avanza e cvt at,,0,2025,,,,0
bmw 320i g20 sport dynamic,,0,2025,,,,0
honda crv turbo at,,0,2025,,,,0
toyota kijang innova zenix v premium color mpv,,0,2025,,,,0
toyota calya g mpv,,0,2025,,,,0
toyota kijang innova g bensin at,,0,2025,,,,0
all new kijang innova diesel manual,,0,2025,,,,0
kia sonet premier at,,0,2025,,,,0
honda city es turbo at,,0,2025,,,,0
toyota veloz q tss,,0,2025,,,,0
kia sportage at,,0,2025,,,,0
toyota avanza e cvt,,0,2025,,,,0
mazda mazda mx5 20 at,,0,2025,,,,0
honda brio satya e cvt putih,,0,2025,,,,0
toyota kijang innova reborn g bensin at,,0,2025,,,,0
honda brio e,,0,2025,,,,0
daihatsu all new xenia r cvt,,0,2025,,,,0
kijang innova v at hitam,,0,2025,,,,0
mercedes benz gle450 amg 4matic,,0,2025,,,,0
honda brio rs at abu metalik,,0,2025,,,,0
honda jazz rs merah,,0,2025,,,,0
toyota avanza 15 g mt,,0,2025,,,,0
toyota avanza g at matic merah,,0,2025,,,,0
hrv prestige,,0,2025,,,,0
daihatsu terios r at silver,,0,2025,,,,0
toyota calya g mt,,0,2025,,,,0
toyota innova 20 j bensin mt,,0,2025,,,,0
mini cooper 5 door,,0,2025,,,,0
daihatsu sigra x,,0,2025,,,,0
toyota fortuner trd vrz 4x2 at,,0,2025,,,,0
honda jazz rs at putih,,0,2025,,,,0
toyota avanza,,0,2025,,,,0
honda brio 12 e at,,0,2025,,,,0
suzuki jimny two tone,,0,2025,,,,0
bmw 530i luxury sedan,,0,2025,,,,0
toyota innova venturer at,,0,2025,,,,0
honda brio e satya at abu,,0,2025,,,,0
toyota avanza g tss bensin at,,0,2025,,,,0
lexus es300h ultra luxury hybrid facelift,,0,2025,,,,0
toyota kijang innova zenix v,,0,2025,,,,0
honda brio 12 e cvt,,0,2025,,,,0
bmw 730li sedan m sport,,0,2025,,,,0
toyota alphard sc at,,0,2025,,,,0
pajero dakar 4x2 at,,0,2025,,,,0
suzuki new baleno 1400 at,,0,2025,,,,0
honda brio rs merah,,0,2025,,,,0
toyota avanza veloz mt,,0,2025,,,,0
toyota innova venturer hitam,,0,2025,,,,0
wuling bingo ev long range,,0,2025,,,,0
toyota kijang innova g lux capt seat,,0,2025,,,,0
toyota kijang innova g mpv luxury cc mt 2021,,0,2025,,,,0
bmw 330i m sport at,,0,2025,,,,0
honda jazz rs at,,0,2025,,,,0
bmw 740li g12 b58 luxury sedan,,0,2025,,,,0
toyota kijang innova zenix g hybrid at,,0,2025,,,,0
mazda 3 hb skyactiv at,,0,2025,,,,0
honda brv prestige honda sensing suv,,0,2025,,,,0
honda brio e mt,,0,2025,,,,0
jual yaris trd,,0,2025,,,,0
honda brio e at,,0,2025,,,,0
honda brio rs cvt at kuning,,0,2025,,,,0
toyota alphard hev mpv,,0,2025,,,,0
daihatsu sirion at,,0,2025,,,,0
bmw 330i m sport g20 turbo,,0,2025,,,,0
mercedes benz s450,,0,2025,,,,0
nissan serena hws,,0,2025,,,,0
toyots agya g trd,,0,2025,,,,0
daihatsu xenia,,0,2025,,,,0
nissan teana xv at,,0,2025,,,,0
wuling confero type std double blower special edition 1500 mt,,0,2025,,,,0
toyota fortuner vrz at,,0,2025,,,,0
honda brio rs silver,,0,2025,,,,0
toyota calya g mt silver,,0,2025,,,,0
toyota innova g,,0,2025,,,,0
toyota innova v zenix bensin at,,0,2025,,,,0
toyota sienta q bensin,,0,2025,,,,0
wuling bingo ev,,0,2025,,,,0
toyota avanza veloz q automatic,,0,2025,,,,0
mercedes benz a200,,0,2025,,,,0
toyota alphard g atpm,,0,2025,,,,0
toyota avanza g tss at,,0,2025,,,,0
toyota innova zenix v automatic putih,,0,2025,,,,0
toyota all new yaris cross s gr hev,,0,2025,,,,0
honda brio rs cvt urbanite edition at,,0,2025,,,,0
daihatsu sigra type d minor change 1000 mt,,0,2025,,,,0
honda brio rs cvt,,0,2025,,,,0
hyundai creta 1 5 trend at,,0,2025,,,,0
honda mobilio e,,0,2025,,,,0
toyota innova zenix g hv hybrid at,,0,2025,,,,0
toyota avanza veloz 1 5 matic,,0,2025,,,,0
kia carrens at,,0,2025,,,,0
hyundai santa fe at,,0,2025,,,,0
mitsubishi xpander gls at,,0,2025,,,,0
toyota fortuner vrz diesel 2020 hitam,,0,2025,,,,0
honda city hatchback rs at putih,,0,2025,,,,0
toyota kijang innova zenix q hv cvt tss modellista hybrid,,0,2025,,,,0
toyota avanza g,,0,2025,,,,0
honda crv turbo prestige,,0,2025,,,,0
honda accord turbo sensing,,0,2025,,,,0
toyota voxy hitam,,0,2025,,,,0
nissan terra vl at diesel,,0,2025,,,,0
toyota kijang v at,,0,2025,,,,0
mercedes benz gla 200 amg 15 at,,0,2025,,,,0
suzuki xl7 alpha hybrid,,0,2025,,,,0
honda jazz rs at2015,,0,2025,,,,0
fortuner g 27 at bdg,,0,2025,,,,0
toyota calya g lcgc lux 1200 mt,,0,2025,,,,0
mitsubishi xpander ultimate at hitam,,0,2025,,,,0
lexus ux200 sport at,,0,2025,,,,0
pajero dakar 4x4,,0,2025,,,,0
honda brio satya e mt,,0,2025,,,,0
toyota avanza g at matic putih,,0,2025,,,,0
toyota aln avanza g mt,,0,2025,,,,0
toyota camry hybrid at,,0,2025,,,,0
toyota kijang innova zenix automatic,,0,2025,,,,0
toyota yaris s trd heykers,,0,2025,,,,0
bmw x5 xdrive40i g05 xline,,0,2025,,,,0
toyota innova v solar matic,,0,2025,,,,0
