Nama Mobil,Harga,Tahun,Usia,Bahan Bakar,Transmisi,Kapasitas Mesin,harga_angka
Innova Zenix Q Modelista At Tss Hybrid Ev (2022),Rp 458.000.000,2022,3,Hybrid,Matic,2000 cc,458000000
Toyota Fortuner 2.4vrzatdsl (2021),Rp 458.500.000,2021,4,Diesel,Matic,2500 cc,458500000
Toyota Yaris G At  Orange (2018),Rp 157.000.000,2018,7,Bensin,Matic,1500 cc,157000000
Honda Brio Rs (2020),Rp 155.000.000,2020,5,Bensin,Matic,1200 cc,155000000
Daihatsu Terios (2017),Rp 159.000.000,2017,8,Bensin,Matic,1500 cc,159000000
Toyota Kijang Innova (2022),Rp 465.000.000,2022,3,Bensin,Matic,2400 cc,465000000
Toyota Kijang Innova G Mpv (2020),Rp 262.000.000,2020,5,Bensin,Matic,2000 cc,262000000
Toyota Kijang Inova G Luxury Matic (2019),Rp 310.000.000,2019,6,Bensin,Matic,2500 cc,310000000
Honda Brio 12 E At (2023),Rp 160.000.000,2023,2,Bensin,Matic,1200 cc,160000000
Honda Jazz Rs (2017),Rp 189.000.000,2017,8,Bensin,Matic,1500 cc,189000000
Toyota Kijang Innova G Mpv (2016),Rp 220.000.000,2016,9,Bensin,Matic,2000 cc,220000000
Toyota Innova Zenix Q Tss Modelista (2023),Rp 535.000.000,2023,2,Hybrid,Matic,1500 cc,535000000
Toyota All New Veloz Q Cvt (2022),Rp 245.000.000,2022,3,Bensin,Matic,1500 cc,245000000
Toyota Camry Hybrid At (2015),Rp 165.000.000,2015,10,Hybrid,Matic,2500 cc,165000000
Bmw 330i M Sport Sedan (2022),Rp 765.000.000,2022,3,Bensin,Matic,2000 cc,765000000
Toyota Avanza G At (2015),Rp 118.000.000,2015,10,Bensin,Matic,1300 cc,118000000
Honda Mobilio Rs At  Hitam (2021),Rp 187.000.000,2021,4,Bensin,Matic,1500 cc,187000000
Brio E Cvt  Matic (2017),Rp 125.000.000,2017,8,Bensin,Matic,1500 cc,125000000
Daihatsu Sigra D Lcgc Minor Change 1000 Mt (2021),Rp 116.000.000,2021,4,Bensin,Manual,1000 cc,116000000
Honda City Hatchback Rs At  Putih (2022),Rp 229.000.000,2022,3,Bensin,Matic,1500 cc,229000000
Honda Crv Turbo Prestige At (2018),Rp 295.000.000,2018,7,Bensin,Matic,1500 cc,295000000
Mitsubishi Mirage Glx (2016),Rp 85.000.000,2016,9,Bensin,Manual,1200 cc,85000000
Toyota Avanza Veloz Q Cvt At (2023),Rp 239.000.000,2023,2,Bensin,Matic,1500 cc,239000000
Honda Crv Turbo Prestige (2017),Rp 310.000.000,2017,8,Bensin,Matic,1500 cc,310000000
Honda Brio E M/t (2022),Rp 123.000.000,2022,3,Bensin,Matic,1200 cc,123000000
Toyota Kijang Innova Zenix (2022),Rp 540.000.000,2022,3,Hybrid,Matic,2000 cc,540000000
Toyota Kijang Innova Venturer (2019),Rp 295.000.000,2019,6,Bensin,Matic,2000 cc,295000000
Toyota Kijang Innova Zenix V Cvt (2024),Rp 399.000.000,2024,1,Hybrid,Matic,2000 cc,399000000
Toyota Alphard X Mpv (2018),Rp 555.000.000,2018,7,Bensin,Matic,2500 cc,555000000
Toyota Avanza Veloz Q Bensin At (2022),Rp 225.000.000,2022,3,Bensin,Matic,1500 cc,225000000
Toyota Innova G At Diesel (2024),Rp 375.000.000,2024,1,Diesel,Matic,2400 cc,375000000
Honda Brio Satya E (2022),Rp 150.000.000,2022,3,Bensin,Matic,1200 cc,150000000
Nissan Serena Hws (2019),Rp 255.000.000,2019,6,Bensin,Matic,2000 cc,255000000
Toyota Avanza Mpv Premium (2020),Rp 151.000.000,2020,5,Bensin,Matic,1300 cc,151000000
Toyota Agya G Trd Mt (2019),Rp 120.000.000,2019,6,Bensin,Manual,1200 cc,120000000
Toyota Innova 20 V Bensin At (2017),Rp 258.000.000,2017,8,Bensin,Matic,1500 cc,258000000
Toyota Kijang Innova (2021),Rp 295.000.000,2021,4,Bensin,Matic,2000 cc,295000000
Daihatsu Sigra X (2021),Rp 123.000.000,2021,4,Bensin,Matic,1200 cc,123000000
Toyota Avanza G Mpv (2016),Rp 139.000.000,2016,9,Bensin,Matic,1300 cc,139000000
Mitsubishi Xpander Cross Premium Mpv (2020),Rp 229.000.000,2020,5,Bensin,Matic,1500 cc,229000000
Toyota Camry V (2021),Rp 424.000.000,2021,4,Bensin,Matic,2500 cc,424000000
Nissan Serena Hws (2017),Rp 195.000.000,2017,8,Bensin,Matic,2000 cc,195000000
Toyota Innova Zenix (2023),Rp 575.000.000,2023,2,Hybrid,Matic,2000 cc,575000000
Toyota Fortuner Gr Sport 4x4 (2024),Rp 575.000.000,2024,1,Diesel,Matic,2800 cc,575000000
Fortuner Vrz 4x2 (2023),Rp 575.000.000,2023,2,Diesel,Matic,2800 cc,575000000
Toyota Fortuner Vrz (2024),Rp 545.000.000,2024,1,Diesel,Matic,2800 cc,545000000
Toyota Avanza E Cvt (2023),Rp 184.000.000,2023,2,Bensin,Matic,1300 cc,184000000
Toyota Avanza Veloz (2021),Rp 190.000.000,2021,4,Bensin,Matic,1500 cc,190000000
Toyota Innova G Mt (2018),Rp 330.000.000,2018,7,Diesel,Manual,2400 cc,330000000
Toyota Avanza E At (2019),Rp 136.000.000,2019,6,Bensin,Matic,1300 cc,136000000
Honda Hrv Prestige 1.8 At (2016),Rp 225.000.000,2016,9,Bensin,Matic,1800 cc,225000000
Daihatsu Sigra Type D (2023),Rp 124.000.000,2023,2,Bensin,Manual,1000 cc,124000000
Toyota Veloz Q Tss Mpv (2021),Rp 234.000.000,2021,4,Bensin,Matic,1500 cc,234000000
Toyots Agya G Trd (2021),Rp 131.000.000,2021,4,Bensin,Matic,1200 cc,131000000
Toyota Veloz Q Tss At  Putih (2021),Rp 232.000.000,2021,4,Bensin,Matic,1500 cc,232000000
Toyota Kijang Innova V At (2018),Rp 260.000.000,2018,7,Bensin,Matic,2000 cc,260000000
Innova G Bensin At (2017),Rp 235.000.000,2017,8,Bensin,Matic,2000 cc,235000000
Daihatsu Terios R Deluxe At  Hitam (2019),Rp 197.000.000,2019,6,Bensin,Matic,1500 cc,197000000
Toyota Kijang Innova V At (2022),Rp 308.000.000,2022,3,Bensin,Matic,2000 cc,308000000
Daihatsu Ayla X Mt (2023),Rp 119.000.000,2023,2,Bensin,Manual,1200 cc,119000000
Mazda Cx3 Sport At (2024),Rp 329.000.000,2024,1,Bensin,Matic,1500 cc,329000000
Honda Brio Satya E (2018),Rp 124.000.000,2018,7,Bensin,Matic,1200 cc,124000000
Nissan Terra Vl 4x4 Diesel (2023),Rp 615.000.000,2023,2,Diesel,Matic,2500 cc,615000000
Honda Hrv Prestige Suv (2021),Rp 286.000.000,2021,4,Bensin,Matic,1800 cc,286000000
Toyota New Avanza Veloz Mpv 1500 At (2021),Rp 215.000.000,2021,4,Bensin,Matic,1500 cc,215000000
Honda Jazz Gk5 Rs Cvt Ckd  Merah (2016),Rp 180.000.000,2016,9,Bensin,Matic,1500 cc,180000000
Daihatsu Sigra Type D Minor Change 1000 Mt (2022),Rp 120.000.000,2022,3,Bensin,Manual,1000 cc,120000000
Wuling Confero Type Std Double Blower Special Edition 1500 Mt (2022),Rp 118.000.000,2022,3,Bensin,Manual,1500 cc,118000000
Toyota Calya G At  Silver (2016),Rp 106.000.000,2016,9,Bensin,Matic,1500 cc,106000000
Wuling Confero Type Std Double Blower Special Edition 1500 Mt (2022),Rp 118.000.000,2022,3,Bensin,Manual,1500 cc,118000000
Daihatsu Sigra Type D Minor Change 1000 Mt (2024),Rp 128.000.000,2024,1,Bensin,Manual,1000 cc,128000000
Toyota Avanza G Mpv  Hitam (2022),Rp 203.000.000,2022,3,Bensin,Matic,1500 cc,203000000
Toyota Avanza E Bensin Mt (2016),Rp 123.000.000,2016,9,Bensin,Manual,1300 cc,123000000
Toyota Avanza 13 G Mt (2017),Rp 142.000.000,2017,8,Bensin,Manual,1500 cc,142000000
Honda Brio Satya E Hatchback (2022),Rp 156.000.000,2022,3,Bensin,Matic,1200 cc,156000000
Toyota Alphard G Atpm Hitam (2017),Rp 625.000.000,2017,8,Bensin,Matic,2500 cc,625000000
Toyota Avanza Veloz Q Cvt (2024),Rp 230.000.000,2024,1,Bensin,Matic,1500 cc,230000000
Toyota All New Avanza Veloz Q (2022),Rp 225.000.000,2022,3,Bensin,Matic,1500 cc,225000000
Toyota Avanza G Mt (2015),Rp 125.000.000,2015,10,Bensin,Manual,1300 cc,125000000
Bmw 528i Msport F10 Lci Tahun (2015),Rp 314.000.000,2015,10,Bensin,Matic,2000 cc,314000000
Bmw 528i Luxury Sedan (2015),Rp 390.000.000,2015,10,Bensin,Matic,2000 cc,390000000
Honda Mobilio E At (2019),Rp 160.000.000,2019,6,Bensin,Matic,1500 cc,160000000
Toyota Fortuner Vrz Trd (2020),Rp 426.000.000,2020,5,Diesel,Matic,2400 cc,426000000
Toyota Avanza G Tss At (2021),Rp 196.000.000,2021,4,Bensin,Matic,1500 cc,196000000
Mitsubishi Xpander Ultimate At  Silver (2019),Rp 205.000.000,2019,6,Bensin,Matic,1500 cc,205000000
Daihatsu Sigra R Mt (2021),Rp 142.500.000,2021,4,Bensin,Manual,1200 cc,142500000
Toyota Yaris Gr Sport At  Putih (2022),Rp 232.000.000,2022,3,Bensin,Matic,1500 cc,232000000
Toyota Kijang Innova V Mt (2021),Rp 295.000.000,2021,4,Bensin,Manual,2000 cc,295000000
Suzuki Ertiga Gx At (2018),Rp 165.000.000,2018,7,Bensin,Matic,1500 cc,165000000
Honda Brio Satya E  Merah (2020),Rp 132.000.000,2020,5,Bensin,Manual,1200 cc,132000000
Nissan All New X Trail 2500 At (2015),Rp 205.000.000,2015,10,Bensin,Matic,2500 cc,205000000
Toyota Alphard G Atpm (2017),Rp 650.000.000,2017,8,Bensin,Matic,2400 cc,650000000
Toyota Veloz Q Tss Premium Color Mpv (2025),Rp 243.000.000,2025,0,Bensin,Matic,1500 cc,243000000
Toyota Avanza G Mpv (2021),Rp 163.000.000,2021,4,Bensin,Matic,1300 cc,163000000
Toyota Kijang Innova Zenix V Premium Color Mpv (2023),Rp 387.000.000,2023,2,Hybrid,Matic,2000 cc,387000000
Toyota Avanza Veloz (2021),Rp 219.500.000,2021,4,Bensin,Matic,1500 cc,219500000
Daihatsu All New Xenia X Mpv 1300 Mt (2024),Rp 211.000.000,2024,1,Bensin,Manual,1300 cc,211000000
Daihatsu All New Xenia X Mpv 1300 Cvt (2023),Rp 211.000.000,2023,2,Bensin,Matic,1300 cc,211000000
Honda Jazz Rs (2020),Rp 230.000.000,2020,5,Bensin,Matic,1500 cc,230000000
Toyota Kijang Innova Zenix V Cvt (2022),Rp 382.000.000,2022,3,Hybrid,Matic,2000 cc,382000000
Toyota Innova Venturer  Hitam (2019),Rp 307.000.000,2019,6,Bensin,Matic,2000 cc,307000000
Honda Jazz (2016),Rp 185.000.000,2016,9,Bensin,Matic,1500 cc,185000000
Honda Brio Satya E  Abu (2019),Rp 139.000.000,2019,6,Bensin,Manual,1200 cc,139000000
Toyota Innova Zenix Q Hybrid At (2024),Rp 541.000.000,2024,1,Hybrid,Matic,2000 cc,541000000
Toyota Avanza G Matic (2019),Rp 165.000.000,2019,6,Bensin,Matic,1300 cc,165000000
Toyota Kijang Innova G Mpv Luxury  Cc Mt 2021 (2021),Rp 305.000.000,2021,4,Bensin,Matic,2000 cc,305000000
Daihatsu Sigra Type D Minor Change 1000 Mt (2022),Rp 120.000.000,2022,3,Bensin,Manual,1000 cc,120000000
Honda Brio Satya E (2021),Rp 136.000.000,2021,4,Bensin,Manual,1200 cc,136000000
Toyota Avanza Veloz (2023),Rp 220.000.000,2023,2,Bensin,Manual,1500 cc,220000000
Toyota Avanza G Mt (2015),Rp 125.000.000,2015,10,Bensin,Manual,1300 cc,125000000
Suzuki Ertiga Gx Hybrid (2023),Rp 211.000.000,2023,2,Hybrid,Matic,1500 cc,211000000
Suzuki Ertiga Gx Hybrid AT (2022),Rp 194.000.000,2022,3,Hybrid,Matic,1500 cc,194000000
Honda Brio Satya E Cvt (2021),Rp 148.000.000,2021,4,Bensin,Matic,1200 cc,148000000
Toyota Zenix V At (2022),Rp 375.000.000,2022,3,Hybrid,Matic,2000 cc,375000000
Toyota Avanza E Mpv  Hitam (2019),Rp 140.000.000,2019,6,Bensin,Matic,1300 cc,140000000
Toyota Kijang Innova Zenix G At (2024),Rp 345.000.000,2024,1,Hybrid,Matic,2000 cc,345000000
Toyota Calya G Mt  Silver (2024),Rp 141.000.000,2024,1,Bensin,Manual,1200 cc,141000000
Daihatsu Ayla  R (2022),Rp 131.000.000,2022,3,Bensin,Matic,1200 cc,131000000
Toyota New Agya Type G Trd Sportivo 1200 Mt (2019),Rp 132.000.000,2019,6,Bensin,Manual,1200 cc,132000000
Toyota Innova Venturer Wagon Km 36 Rbuan (2022),Rp 495.000.000,2022,3,Bensin,Matic,2000 cc,495000000
Toyota Kijang Innova Zenix (2023),Rp 525.000.000,2023,2,Hybrid,Matic,2000 cc,525000000
Mazda 2 Gt At (2022),Rp 228.000.000,2022,3,Bensin,Matic,1500 cc,228000000
Toyota Veloz Q Tss (2022),Rp 243.000.000,2022,3,Bensin,Matic,1500 cc,243000000
Honda All New Brv Type Prestige Sensing 1500 Cvt (2023),Rp 255.000.000,2023,2,Bensin,Matic,1500 cc,255000000
Mazda Biante At (2015),Rp 130.000.000,2015,10,Bensin,Matic,2000 cc,130000000
Suzuki Ignis (2023),Rp 167.000.000,2023,2,Bensin,Matic,1200 cc,167000000
Honda Jazz Rs Silver (2016),Rp 184.000.000,2016,9,Bensin,Matic,1500 cc,184000000
Toyota Avanza G Mt (2019),Rp 162.000.000,2019,6,Bensin,Manual,1300 cc,162000000
Hrv Prestige (2015),Rp 205.000.000,2015,10,Bensin,Matic,1800 cc,205000000
Toyota Innova V Zenix Bensin At (2022),Rp 398.000.000,2022,3,Hybrid,Matic,2000 cc,398000000
Honda Hrv E 15 Matic  2017 Grey Antik Km Rendah (2016),Rp 177.850.000,2016,9,Bensin,Matic,1500 cc,177850000
Suzuki New Baleno 1400 At (2021),Rp 185.000.000,2021,4,Bensin,Matic,1400 cc,185000000
Toyota Avanza E Mpv (2020),Rp 153.000.000,2020,5,Bensin,Matic,1300 cc,153000000
Honda Brio Satya E At (2021),Rp 148.000.000,2021,4,Bensin,Matic,1200 cc,148000000
Toyota Avanza Veloz Q Cvt At (2022),Rp 223.000.000,2022,3,Bensin,Matic,1500 cc,223000000
Toyota Avanza Veloz Q Cvt At (2022),Rp 232.000.000,2022,3,Bensin,Matic,1500 cc,232000000
Toyota Avanza Veloz Putih (2021),Rp 193.000.000,2021,4,Bensin,Matic,1500 cc,193000000
Toyota Kijang Innova Zenix (2023),Rp 390.000.000,2023,2,Hybrid,Matic,2000 cc,390000000
Toyota Fortuner Vrz Gr Sport (2022),Rp 494.000.000,2022,3,Diesel,Matic,2800 cc,494000000
Honda Brio Rs Hatchback (2017),Rp 126.000.000,2017,8,Bensin,Matic,1200 cc,126000000
Toyota Innova Mt Diesel (2020),Rp 348.000.000,2020,5,Diesel,Manual,2400 cc,348000000
Mitsubishi Pajero Dakkar 4x2 At (2015),Rp 360.000.000,2015,10,Diesel,Matic,2400 cc,360000000
Honda Jazz Rs (2015),Rp 147.000.000,2015,10,Bensin,Matic,1500 cc,147000000
Honda Brio E Cvt At (2022),Rp 157.000.000,2022,3,Bensin,Matic,1200 cc,157000000
Honda Brio Rs  Silver (2021),Rp 172.000.000,2021,4,Bensin,Matic,1200 cc,172000000
Toyota Kijang Innova Venturer Solar At (2019),Rp 420.000.000,2019,6,Diesel,Matic,2400 cc,420000000
Mitsubishi Xpander Ultimate Mpv (2019),Rp 205.000.000,2019,6,Bensin,Matic,1500 cc,205000000
Honda Brio Rs (2017),Rp 124.000.000,2017,8,Bensin,Manual,1200 cc,124000000
Honda Jazz Rs  Putih (2019),Rp 217.000.000,2019,6,Bensin,Matic,1500 cc,217000000
Avanza Veloz Matic (2017),Rp 156.000.000,2017,8,Bensin,Matic,1500 cc,156000000
Daihatsu New Ayla Type D Plus Minor Change 1000 Mt (2018),Rp 101.000.000,2018,7,Bensin,Manual,1000 cc,101000000
Toyota Avanza Veloz Q (2023),Rp 243.000.000,2023,2,Bensin,Matic,1500 cc,243000000
Daihatsu Sirion At (2018),Rp 142.000.000,2018,7,Bensin,Matic,1300 cc,142000000
Honda Crv Turbo Prestige At (2020),Rp 375.000.000,2020,5,Bensin,Matic,1500 cc,375000000
Toyota Avanza G Mpv (2021),Rp 165.000.000,2021,4,Bensin,Matic,1300 cc,165000000
Toyota Kijang Innova Venturer Solar At (2021),Rp 468.000.000,2021,4,Diesel,Matic,2400 cc,468000000
Toyota Kijang Innova Zenix G Cvt Bensin At (2024),Rp 378.000.000,2024,1,Hybrid,Matic,2000 cc,378000000
Mitsubishi Xpander Exceed At  Silver (2019),Rp 185.000.000,2019,6,Bensin,Matic,1500 cc,185000000
Toyota New Avanza G Mpv Facelift 1300 Mt (2019),Rp 179.000.000,2019,6,Bensin,Manual,1300 cc,179000000
Honda Jazz Rs At (2020),Rp 225.000.000,2020,5,Bensin,Matic,1500 cc,225000000
Toyota Kijang Innova V Bensin At (2022),Rp 385.000.000,2022,3,Bensin,Matic,2000 cc,385000000
Mitsubishi Pajero Sport (2016),Rp 359.500.000,2016,9,Diesel,Manual,2400 cc,359500000
Honda Jazz S  Abu (2018),Rp 169.000.000,2018,7,Bensin,Matic,1500 cc,169000000
Toyota Alphard G Mpv (2025),Rp 895.000.000,2025,0,Bensin,Matic,2500 cc,895000000
Toyota Fortuner Trd Vrz 4x2 At (2019),Rp 350.000.000,2019,6,Bensin,Matic,2755 cc,350000000
Toyota Voxy At Cbu (2018),Rp 315.000.000,2018,7,Bensin,Matic,2000 cc,315000000
Dijual Mitsubishi Delica D5 Non Royal Tahun (2015),Rp 160.000.000,2015,10,Bensin,Matic,2000 cc,160000000
Toyota Calya G Mt (2019),Rp 135.000.000,2019,6,Bensin,Manual,1200 cc,135000000
Nissan Xtrail Xt Suv (2018),Rp 215.000.000,2018,7,Bensin,Matic,2500 cc,215000000
Toyota Innova Zenix G At (2023),Rp 360.000.000,2023,2,Hybrid,Matic,2000 cc,360000000
Nissan Terra Vl At Diesel (2018),Rp 325.000.000,2018,7,Diesel,Matic,2500 cc,325000000
Toyota New Avanza Type E Facelift 1300 Mt (2021),Rp 175.000.000,2021,4,Bensin,Manual,1300 cc,175000000
Honda Hrv S Cvt (2018),Rp 195.000.000,2018,7,Bensin,Matic,1500 cc,195000000
Toyota Calya G At  Nik 2023 (2023),Rp 125.000.000,2023,2,Bensin,Matic,1200 cc,125000000
Toyota Grn New Avanza G Mt (2020),Rp 195.000.000,2020,5,Bensin,Manual,1300 cc,195000000
Toyota Innova G At (2015),Rp 179.000.000,2015,10,Bensin,Matic,2000 cc,179000000
Nissan Serena Highway Starr (2019),Rp 250.000.000,2019,6,Bensin,Matic,2000 cc,250000000
Toyota Kijang Innova (2021),Rp 292.000.000,2021,4,Bensin,Matic,2400 cc,292000000
Toyota Avanza G Mt (2016),Rp 140.000.000,2016,9,Bensin,Manual,1300 cc,140000000
Honda Jazz Rs (2017),Rp 200.000.000,2017,8,Bensin,Matic,1500 cc,200000000
Toyota Veloz Q Tss Mpv (2021),Rp 235.000.000,2021,4,Bensin,Matic,1500 cc,235000000
Toyota Kijang Innova Zenix  Silver (2023),Rp 397.000.000,2023,2,Hybrid,Matic,2000 cc,397000000
Mitsubishi Outlander Gls At (2015),Rp 140.000.000,2015,10,Bensin,Matic,2000 cc,140000000
Honda Brio Satya E Cvt (2019),Rp 138.000.000,2019,6,Bensin,Matic,1200 cc,138000000
Mitsubishi Xpander (2021),Rp 222.000.000,2021,4,Bensin,Matic,1500 cc,222000000
Toyota Avanza Veloz (2021),Rp 193.000.000,2021,4,Bensin,Matic,1500 cc,193000000
Toyota Calya G Mt (2024),Rp 165.000.000,2024,1,Bensin,Manual,1200 cc,165000000
Toyota Avanza G At Matic  Merah (2015),Rp 118.500.000,2015,10,Bensin,Matic,1300 cc,118500000
Honda Brio E At (2019),Rp 145.000.000,2019,6,Bensin,Matic,1200 cc,145000000
Honda Brio E Cvt (2018),Rp 127.500.000,2018,7,Bensin,Matic,1200 cc,127500000
Suzuki Baleno Hatchback At (2019),Rp 171.000.000,2019,6,Bensin,Matic,1500 cc,171000000
Mercedes Benz C200 Eq Boost W205 Avantgarde (2019),Rp 442.000.000,2019,6,Bensin,Matic,1500 cc,442000000
Toyota Innova V At (2022),Rp 365.000.000,2022,3,Diesel,Matic,2400 cc,365000000
Honda Hrv S Cvt (2018),Rp 205.000.000,2018,7,Bensin,Matic,1500 cc,205000000
Toyota Kijang Innova Venturer Mpv (2019),Rp 291.000.000,2019,6,Bensin,Matic,2000 cc,291000000
Toyota Kijang Innova (2015),Rp 135.000.000,2015,10,Bensin,Matic,2000 cc,135000000
Honda Brio E (2016),Rp 117.000.000,2016,9,Bensin,Matic,1500 cc,117000000
Toyota Kijang Innova G Mpv (2020),Rp 257.000.000,2020,5,Bensin,Matic,2000 cc,257000000
Jual Yaris Trd (2018),Rp 205.000.000,2018,7,Bensin,Matic,1500 cc,205000000
Honda Brio Rs (2022),Rp 167.500.000,2022,3,Bensin,Matic,1200 cc,167500000
Honda Brio Rs Hatchback (2021),Rp 170.000.000,2021,4,Bensin,Matic,1200 cc,170000000
Toyota Innova G 20 At (2020),Rp 288.000.000,2020,5,Bensin,Matic,1500 cc,288000000
Daihatsu Ayla (2022),Rp 131.000.000,2022,3,Bensin,Matic,1200 cc,131000000
Toyota Avanza Veloz 1 5 Matic (2015),Rp 143.000.000,2015,10,Bensin,Matic,1500 cc,143000000
Toyota Veloz Q Tss Premium Color Mpv (2022),Rp 242.000.000,2022,3,Bensin,Matic,1500 cc,242000000
Toyota Calya G Mt (2021),Rp 145.000.000,2021,4,Bensin,Manual,1200 cc,145000000
Toyota Avanza (2021),Rp 165.000.000,2021,4,Bensin,Manual,1300 cc,165000000
Honda Brv Prestige Cvt At (2022),Rp 232.000.000,2022,3,Bensin,Matic,1500 cc,232000000
Toyota Vellfire Z At (2015),Rp 230.000.000,2015,10,Bensin,Matic,2400 cc,230000000
Jazz Rs Matic (2015),Rp 137.000.000,2015,10,Bensin,Matic,1500 cc,137000000
Toyota Innova G At (2017),Rp 220.000.000,2017,8,Bensin,Matic,2000 cc,220000000
Toyota Kijang Innova V Mpv (2021),Rp 382.000.000,2021,4,Bensin,Matic,2400 cc,382000000
Suzuki Ertiga Sport At (2019),Rp 185.000.000,2019,6,Bensin,Matic,1500 cc,185000000
Toyota Innova V Luxury (2015),Rp 149.000.000,2015,10,Bensin,Matic,1500 cc,149000000
Toyota Hiace Type Commuter 2500 Mt (2019),Rp 475.000.000,2019,6,Diesel,Manual,2500 cc,475000000
Toyota Kijang Innova G Bensin At (2022),Rp 287.000.000,2022,3,Bensin,Matic,2000 cc,287000000
Honda Brio Rs Abu (2021),Rp 171.000.000,2021,4,Bensin,Matic,1200 cc,171000000
Toyota Kijang Innova G Bensin At (2015),Rp 165.000.000,2015,10,Bensin,Matic,2000 cc,165000000
Honda Brio Rs At (2021),Rp 176.000.000,2021,4,Bensin,Matic,1200 cc,176000000
Toyota Yaris S Trd Heykers (2017),Rp 170.000.000,2017,8,Bensin,Matic,1500 cc,170000000
Toyota Veloz Q Tss At  Hitam (2022),Rp 238.000.000,2022,3,Bensin,Matic,1500 cc,238000000
Daihatsu Ayla X Mt (2015),Rp 73.000.000,2015,10,Bensin,Manual,1000 cc,73000000
Toyota Veloz Q Tss Mpv (2021),Rp 232.000.000,2021,4,Bensin,Matic,1500 cc,232000000
Mitsubishi Xpander Ultimate At  Silver (2018),Rp 195.000.000,2018,7,Bensin,Matic,1500 cc,195000000
Toyota Avanza (2021),Rp 202.000.000,2021,4,Bensin,Matic,1500 cc,202000000
Ayla 12 R  Manual (2017),Rp 100.100.100,2017,8,Bensin,Manual,1200 cc,100100100
Honda Jazz Rs Cvt (2018),Rp 205.000.000,2018,7,Bensin,Matic,1500 cc,205000000
Toyota Avanza Veloz Luxury At (2015),Rp 126.000.000,2015,10,Bensin,Matic,1500 cc,126000000
Honda New Crv Prestige (2015),Rp 225.000.000,2015,10,Bensin,Matic,2400 cc,225000000
Toyotq Sienta Q At (2017),Rp 170.000.000,2017,8,Bensin,Matic,1500 cc,170000000
Toyota Avanza G Bensin At (2017),Rp 124.500.000,2017,8,Bensin,Matic,1300 cc,124500000
Toyota Innova 20 G At (2018),Rp 229.000.000,2018,7,Bensin,Matic,2000 cc,229000000
Toyota Kijang V At (2019),Rp 338.000.000,2019,6,Bensin,Matic,2400 cc,338000000
Toyota Innova Zenix V Hybrid Modelista (2023),Rp 425.000.000,2023,2,Hybrid,Matic,2000 cc,425000000
Toyota Yaris Gr Sport At  Hitam (2022),Rp 232.000.000,2022,3,Bensin,Matic,1500 cc,232000000
Toyota Avanza 13 G At (2020),Rp 175.000.000,2020,5,Bensin,Matic,1500 cc,175000000
Honda Brio E Cvt (2017),Rp 124.900.000,2017,8,Bensin,Matic,1200 cc,124900000
Honda Brio Satya E At (2015),Rp 121.000.000,2015,10,Bensin,Matic,1200 cc,121000000
Toyota Kijang Innova G Bensin At (2018),Rp 225.000.000,2018,7,Bensin,Matic,2000 cc,225000000
Toyota Kijang Innova Zenix (2023),Rp 495.000.000,2023,2,Hybrid,Matic,2000 cc,495000000
Toyota Kijang Innova G Solar Mt (2024),Rp 395.000.000,2024,1,Diesel,Matic,2400 cc,395000000
Suzuki Ertiga Gl At (2020),Rp 175.000.000,2020,5,Bensin,Matic,1500 cc,175000000
Toyota Avanza Veloz Q  Putih (2022),Rp 229.000.000,2022,3,Bensin,Matic,1500 cc,229000000
Toyota Avanza Veloz (2022),Rp 243.000.000,2022,3,Bensin,Matic,1500 cc,243000000
Toyota Kijang Innova G Bensin At (2021),Rp 289.000.000,2021,4,Bensin,Matic,2000 cc,289000000
Daihatsu Granmax Minibus Type D Ff Fh 1300 Mt (2020),Rp 141.000.000,2020,5,Bensin,Manual,1300 cc,141000000
Honda Hrv E At  Hitam (2018),Rp 215.000.000,2018,7,Bensin,Matic,1500 cc,215000000
Honda Jazz Rs Hatchback (2017),Rp 187.000.000,2017,8,Bensin,Matic,1500 cc,187000000
Mitsubishi Pajero Sport Dakar Ultimate (2019),Rp 435.000.000,2019,6,Diesel,Matic,2400 cc,435000000
Toyota Fortuner Vnt Trd Sportivo Diesel  At (2015),Rp 285.000.000,2015,10,Diesel,Matic,2500 cc,285000000
Toyota Avanza E Bensin Mt (2023),Rp 205.000.000,2023,2,Bensin,Manual,1300 cc,205000000
Toyota Sienta Q Bensin (2017),Rp 150.000.000,2017,8,Bensin,Matic,1500 cc,150000000
Honda Brv E Prestige At  Putih (2021),Rp 207.000.000,2021,4,Bensin,Matic,1500 cc,207000000
Toyota Kijang Innova G Bensin At (2021),Rp 270.000.000,2021,4,Bensin,Matic,2000 cc,270000000
Toyota Calya G Mt (2018),Rp 135.000.000,2018,7,Bensin,Manual,1200 cc,135000000
Honda Jazz Rs At (2019),Rp 255.000.000,2019,6,Bensin,Matic,1500 cc,255000000
Honda Brv Prestige (2017),Rp 175.000.000,2017,8,Bensin,Matic,1500 cc,175000000
Nissan Juke Rx At (2015),Rp 127.000.000,2015,10,Bensin,Matic,1500 cc,127000000
Toyota Innova Reborn V Solar Matic (2018),Rp 357.000.000,2018,7,Diesel,Matic,2400 cc,357000000
Toyota Avanza Veloz Mpv (2020),Rp 178.000.000,2020,5,Bensin,Matic,1400 cc,178000000
Honda Brio E Satya At  Merah (2022),Rp 156.000.000,2022,3,Bensin,Matic,1200 cc,156000000
Veloz Q Matic (2022),Rp 258.000.000,2022,3,Bensin,Matic,1500 cc,258000000
Honda Brio Rs (2018),Rp 140.000.000,2018,7,Bensin,Matic,1200 cc,140000000
Toyota Avanza G Mt (2016),Rp 158.000.000,2016,9,Bensin,Manual,1500 cc,158000000
Toyota Innova G At Diesel (2018),Rp 299.000.000,2018,7,Diesel,Matic,2400 cc,299000000
Toyota Fortuner Vnt Trd (2015),Rp 299.000.000,2015,10,Diesel,Matic,2500 cc,299000000
Honda Brio Satya  Merah (2022),Rp 156.000.000,2022,3,Bensin,Matic,1200 cc,156000000
Honda Jazz Hatchback (2018),Rp 169.000.000,2018,7,Bensin,Matic,1500 cc,169000000
Toyota Avanza Veloz Q Tss Automatic (2022),Rp 240.000.000,2022,3,Bensin,Matic,1500 cc,240000000
Toyota Avanza G Mt (2023),Rp 215.000.000,2023,2,Bensin,Manual,1500 cc,215000000
Toyota All New Avanza G Cvt At (2023),Rp 219.000.000,2023,2,Bensin,Matic,1500 cc,219000000
Honda Jazz Rs At  At (2016),Rp 178.000.000,2016,9,Bensin,Matic,1500 cc,178000000
Mitsubishi Pajero Sport Dakar 4x2 Solar (2018),Rp 380.000.000,2018,7,Diesel,Matic,2400 cc,380000000
Daihatsu Sigra R Deluxe At  Putih (2016),Rp 108.000.000,2016,9,Bensin,Matic,1200 cc,108000000
Suzuki Xl7 Alpha Hybrid (2024),Rp 255.000.000,2024,1,Hybrid,Matic,1462 cc,255000000
Suzuki Xl7 Alpha Hybrid (2025),Rp 205.000.000,2025,0,Hybrid,Matic,1462 cc,205000000
Honda Brio Rs  Oranye (2023),Rp 174.000.000,2023,2,Bensin,Manual,1200 cc,174000000
Toyota Innova Reborn V  At (2019),Rp 299.000.000,2019,6,Bensin,Matic,2000 cc,299000000
Honda Brio Rs Bensin At (2022),Rp 185.000.000,2022,3,Bensin,Matic,1200 cc,185000000
Toyota Calya G Mt (2017),Rp 120.000.000,2017,8,Bensin,Manual,1200 cc,120000000
Toyota All New Veloz Q Cvt (2022),Rp 240.000.000,2022,3,Bensin,Matic,1500 cc,240000000
Kia Sportage At (2015),Rp 125.000.000,2015,10,Bensin,Matic,1500 cc,125000000
Toyota Kijang Innova (2019),Rp 315.000.000,2019,6,Bensin,Matic,2400 cc,315000000
Toyota Innova Zenix 2 0 At (2023),Rp 499.000.000,2023,2,Hybrid,Matic,2000 cc,499000000
Mitsubishi Outlander Sport Px Action At  Hitam (2018),Rp 215.000.000,2018,7,Bensin,Matic,2000 cc,215000000
Toyota Avanza G Mpv (2021),Rp 165.000.000,2021,4,Bensin,Matic,1500 cc,165000000
Toyota Avanza Q Non Tss (2023),Rp 235.500.000,2023,2,Bensin,Matic,1500 cc,235500000
Kijang Innova V At  Hitam (2021),Rp 300.000.000,2021,4,Bensin,Matic,2000 cc,300000000
Toyota Innova Reborn V (2016),Rp 245.000.000,2016,9,Bensin,Matic,2000 cc,245000000
Toyota Avanza G Mt (2017),Rp 135.000.000,2017,8,Bensin,Matic,1300 cc,135000000
Suzuki Xl7 Alpha Mt (2023),Rp 202.500.000,2023,2,Bensin,Manual,1500 cc,202500000
Honda Brio E Satya Mt (2022),Rp 143.000.000,2022,3,Bensin,Manual,1200 cc,143000000
Honda Brio Satya E (2021),Rp 155.000.000,2021,4,Bensin,Matic,1200 cc,155000000
Toyota Avanza Veloz Mpv (2021),Rp 192.000.000,2021,4,Bensin,Matic,1500 cc,192000000
Toyota Innova Venturer 4x2 (2019),Rp 315.000.000,2019,6,Bensin,Matic,2000 cc,315000000
Toyota New Rush S Suv Gr Sport Mt (2022),Rp 245.000.000,2022,3,Bensin,Manual,1500 cc,245000000
Honda Jazz Rs  Merah (2019),Rp 199.000.000,2019,6,Bensin,Manual,1500 cc,199000000
Mitsubishi Xpander Ultimate At (2019),Rp 195.000.000,2019,6,Bensin,Matic,1500 cc,195000000
Toyota Veloz Type Q Tss Cvt (2022),Rp 254.900.000,2022,3,Bensin,Matic,1500 cc,254900000
Toyota Calya Type G Lux 1200 Mt (2022),Rp 148.000.000,2022,3,Bensin,Manual,1200 cc,148000000
Bmw 520i M Sport Package (2023),Rp 1.080.000.000,2023,2,Bensin,Matic,2000 cc,1080000000
